{
  "$schema": "https://gcn.nasa.gov/schema/gcn/notices/swift/bat/guano/alert.schema.json",
  "alert_reporter": {
    "mission": "Swift",
    "instrument": "BAT-GUANO",
    "record_number": 1
  },
  "alert_info": {
    "alert_datetime": "[UTC, ISO 8601]",
    "alert_tense": "current",
    "alert_type": "initial"
  },
  "event_info": {
    "event_id": "name"
  },
  "datetime": {
    "trigger_time": "Time of the trigger [ISO 8601]"
  },
  "statistics": {
    "rate_snr": 7.5,
    "rate_duration": 0.256,
    "rate_energy_range": {
      "energy_low": 15,
      "energy_high": 350
    },
    "classification": "GRB"
  },
  "identifiers": {
    "data_archive_page": "https://swift.gsfc.nasa.gov/archive/"
  }
}
